id,type,name,status,description,duration,startTime,epic
1,TASK,Купить молоко,NEW,Нужно дойти до ближайшего магазина с продуктами и купить молоко,-1,null
2,TASK,Купить телевизор,NEW,Нужно через сайт Ozon заказать телевизор,80,08:00 06.01.24
3,EPIC,Строительство дома,NEW,нужно подготовиться к строительству дома ,-1,null
4,SUB_TASK,Заказ материалов,NEW,Нужно на сайте Леруа мерлен заказать материалы,50,10:00 06.01.24,3
5,SUB_TASK,Найм строителей,NEW,Нужно на сайте Ovito найти строителей,-1,null,3

1